{
  "preflight_id": "preflight-digital",
  "schemaVersion": "design-lab/preflight/v2",
  "profile": "digital",
  "required_checks": [
    {
      "id": "pixel-dimensions",
      "severity": "blocker",
      "tool": "raster"
    },
    {
      "id": "aspect-ratio",
      "severity": "blocker",
      "tool": "raster"
    },
    {
      "id": "file-size",
      "severity": "high",
      "tool": "raster"
    },
    {
      "id": "alpha-channel",
      "severity": "high",
      "tool": "raster"
    },
    {
      "id": "color-profile",
      "severity": "high",
      "tool": "raster"
    },
    {
      "id": "format",
      "severity": "high",
      "tool": "raster"
    },
    {
      "id": "responsive-variants",
      "severity": "medium",
      "tool": "raster"
    },
    {
      "id": "safe-text-region",
      "severity": "high",
      "tool": "raster"
    }
  ]
}
